imdb_id,content_rating,description,director,genre,length,metadata.also_known_as,metadata.asp_retio,metadata.budget,metadata.countries,metadata.filming_locations,metadata.gross,metadata.languages,metadata.sound_mix,original_title,poster.large,poster.thumb,rating,rating_count,release_date,stars,storyline,title,trailer,url.title,url.url,url.year,writers,year
tt0115678,R,A failing Italian restaurant run by two brothers gambles on one special night to try to save the business.,Campbell Scott Stanley Tucci,"['Drama', 'Romance']",109,['Big Night - italialainen ilta'],1.85 : 1,"$4,100,000              (estimated)",['USA'],"['32 Broad Street', 'Keyport', 'New Jersey', 'USA']","$11,881,039              (USA)      (21 February 1997)","['English', 'Italian']","['DTS', 'Dolby']",,https://images-na.ssl-images-amazon.com/images/M/MV5BMTUzMjAzMjMyMl5BMl5BanBnXkFtZTcwNTUzNDIyMQ@@._V1_.jpg,"https://images-na.ssl-images-amazon.com/images/M/MV5BMTUzMjAzMjMyMl5BMl5BanBnXkFtZTcwNTUzNDIyMQ@@._V1_UY268_CR0,0,182,268_AL_.jpg",7.3,"14,102",1996-09-20,"['Tony Shalhoub', 'Stanley Tucci', 'Marc Anthony']","Primo and Secondo are two brothers who have emigrated from Italy to open an Italian restaurant in America. Primo is the irascible and gifted chef, brilliant in his culinary genius, but determined not to squander his talent on making the routine dishes that customers expect. Secondo is the smooth front-man, trying to keep the restaurant financially afloat, despite few patrons other than a poor artist who pays with his paintings. The owner of the nearby Pascal's restaurant, enormously successful (despite its mediocre fare), offers a solution - he will call his friend, a big-time jazz musician, to play a special benefit at their restaurant. Primo begins to prepare his masterpiece, a feast of a lifetime, for the brothers' big night...",Big Night,[],Big Night,http://www.imdb.com/title/tt0115678/?ref_=fn_tt_tt_1,   (1996) ,"['Stanley Tucci', 'Joseph Tropiano']",1996
tt0116329,PG,A father and daughter decide to attempt to lead a flock of orphaned Canada Geese south by air.,Carroll Ballard,"['Adventure', 'Drama', 'Family']",107,['Father Goose'],1.85 : 1,,['USA'],"['Main Street', 'St. Helena', 'Napa Valley', 'California', 'USA']","$24,506,082              (USA)      (12 January 1997)",['English'],"['SDDS(8 channels)', 'Dolby Digital']",,https://images-na.ssl-images-amazon.com/images/M/MV5BMTA0OTE5MDQ0NTBeQTJeQWpwZ15BbWU4MDI5OTc3NTMx._V1_.jpg,"https://images-na.ssl-images-amazon.com/images/M/MV5BMTA0OTE5MDQ0NTBeQTJeQWpwZ15BbWU4MDI5OTc3NTMx._V1_UX182_CR0,0,182,268_AL_.jpg",6.8,"20,902",1996-09-13,"['Jeff Daniels', 'Anna Paquin', 'Dana Delany']","Amy is only 13 years old when her mother is killed in an auto wreck in New Zealand. She goes to Canada to live with her father, an eccentric inventor whom she barely knows. Amy is miserable in her new life...that is until she discovers a nest of goose eggs that were abandoned when developers began tearing up a local forest. The eggs hatch and Amy becomes ""Mama Goose"". The young birds must fly south for the winter, but who will lead them there? With a pair of ultralight airplanes, Amy, her dad and their friends must find a way to do it.",Fly Away Home,[],Fly Away Home,http://www.imdb.com/title/tt0116329/?ref_=fn_tt_tt_1,   (1996) ,"['Bill Lishman', 'Robert Rodat']",1996
tt0117218,PG-13,Grossly overweight yet good-hearted professor Sherman Klump takes a special chemical that turns him into the slim but obnoxious Buddy Love.,Tom Shadyac,"['Comedy', 'Romance', 'Sci-Fi']",95,['El profesor chiflado'],1.85 : 1,"$54,000,000              (estimated)",['USA'],"['Beverly Hills', 'California', 'USA']","$128,814,019              (USA)",['English'],"['DTS', 'Dolby SR', 'DTS-Stereo']",,https://images-na.ssl-images-amazon.com/images/M/MV5BMTcwODlmZDktNWRkOC00NTFlLTkyMjQtYWUxMzZkNDE4MGVmXkEyXkFqcGdeQXVyNTIzOTk5ODM@._V1_.jpg,"https://images-na.ssl-images-amazon.com/images/M/MV5BMTcwODlmZDktNWRkOC00NTFlLTkyMjQtYWUxMzZkNDE4MGVmXkEyXkFqcGdeQXVyNTIzOTk5ODM@._V1_UX182_CR0,0,182,268_AL_.jpg",5.6,"93,550",1996-06-28,"['Eddie Murphy', 'Jada Pinkett Smith', 'James Coburn']","Brilliant and obese scientist Sherman Klump invents a miraculous weight-loss solution. After a date with chemistry student Carla Purty goes badly, a depressed Klump tries the solution on himself. Though he instantly loses 250 pounds, the side effects include a second personality: an obnoxiously self-assertive braggart who calls himself Buddy Love. Buddy proves to be more popular than Sherman, but his arrogance and bad behavior quickly spiral out of control.",The Nutty Professor,[],The Nutty Professor,http://www.imdb.com/title/tt0117218/?ref_=fn_tt_tt_1,   (1996) ,"['Jerry Lewis', 'Bill Richmond']",1996
tt0117333,PG,"An ordinary man sees a bright light descend from the sky, and discovers he now has super-intelligence and telekinesis.",Jon Turteltaub,"['Drama', 'Fantasy', 'Romance']",123,['Fenomen'],2.35 : 1,"$32,000,000              (estimated)",['USA'],"['Petaluma', 'California', 'USA']","$104,636,382              (USA)",['English'],"['Dolby Digital', 'SDDS']",,https://images-na.ssl-images-amazon.com/images/M/MV5BMjAwMDA2NzEyMl5BMl5BanBnXkFtZTgwNTA2MjgxMTE@._V1_.jpg,"https://images-na.ssl-images-amazon.com/images/M/MV5BMjAwMDA2NzEyMl5BMl5BanBnXkFtZTgwNTA2MjgxMTE@._V1_UX182_CR0,0,182,268_AL_.jpg",6.4,"67,258",1996-07-03,"['John Travolta', 'Kyra Sedgwick', 'Forest Whitaker']","John Travolta plays George Malley, who owns the local auto repair shop in a small California town. After celebrating his birthday with friends at the local bar/hang-out, George heads for home. He pauses to watch a strange light in the sky, then collapses for a few seconds in the middle of the deserted street. In the days and weeks that follow, George finds his IQ and consciousness expanding dramatically, and develops telekinetic abilities. Despite his attempts to explain what has happened to him, with just a very few exceptions, most of the local townspeople treat the ""new"" George as a freak. His state of isolation becomes even more pronounced when his new-found abilities allow him to correctly predict an earthquake, and outside authorities become interested in what's happened to him.",Phenomenon,[],Phenomenon,http://www.imdb.com/title/tt0117333/?ref_=fn_tt_tt_1,   (1996) ,['Gerald Di Pego'],1996
tt0117603,R,"Desperation drives four inner-city women (Queen Latifah, Jada Pinkett Smith, Vivica A. Fox, Kimberly Elise) to bank robbery in Los Angeles, then they start mistrusting one another.",F. Gary Gray,"['Action', 'Crime', 'Drama']",123,['A nagy dob&#225;s'],2.35 : 1,"$9,000,000              (estimated)",['USA'],"['Biltmore Hotel - 506 S. Grand Avenue', 'Downtown', 'Los Angeles', 'California', 'USA']","$36,049,108              (USA)      (2 March 1997)",['English'],"['Dolby Digital', 'SDDS']",,https://images-na.ssl-images-amazon.com/images/M/MV5BMjA2MzUxODQ0Nl5BMl5BanBnXkFtZTcwNTQyNzEyMQ@@._V1_.jpg,"https://images-na.ssl-images-amazon.com/images/M/MV5BMjA2MzUxODQ0Nl5BMl5BanBnXkFtZTcwNTQyNzEyMQ@@._V1_UY268_CR6,0,182,268_AL_.jpg",6.8,"11,304",1996-11-06,"['Jada Pinkett Smith', 'Queen Latifah', 'Vivica A. Fox']","Four Black women, all of whom have suffered for lack of money and at the hands of the majority, undertake to rob banks. While initially successful, a policeman who was involved in shooting one of the women's brothers is on their trail. As the women add to the loot, their tastes and interests begin to change and their suspicions of each other increase on the way to a climactic robbery.",Set It Off,[],Set It Off,http://www.imdb.com/title/tt0117603/?ref_=fn_tt_tt_1,   (1996) ,"['Takashi Bufford', 'Takashi Bufford']",1996
tt0117791,R,"The passionate Merchant Ivory drama tells the story of Francoise Gilot, the only lover of Pablo Picasso, who was strong enough to withstand his ferocious cruelty, and move on with her life.",James Ivory,"['Biography', 'Drama', 'Romance']",125,['Ahavotav Shel Picasso'],1.85 : 1,"$16,000,000              (estimated)",['USA'],['France'],"$2,002,000              (USA)",['English'],['Dolby Digital'],,https://images-na.ssl-images-amazon.com/images/M/MV5BMTk2NTI4MTMwMV5BMl5BanBnXkFtZTcwMjE4ODcyMQ@@._V1_.jpg,"https://images-na.ssl-images-amazon.com/images/M/MV5BMTk2NTI4MTMwMV5BMl5BanBnXkFtZTcwMjE4ODcyMQ@@._V1_UX182_CR0,0,182,268_AL_.jpg",6.4,"6,161",1996-09-20,"['Anthony Hopkins', 'Natascha McElhone', 'Julianne Moore']","In 1943, a young painter, Françoise Gilot (1921- ) meets Pablo Picasso (1881-1973), already the most celebrated artist in the world. For the next ten years, she is his mistress, bears him two children, is his muse, and paints within his element. She also learns slowly about the other women who have been or still are in his life: Dora Maar, Marie- Thérèse (whose daughter is Picasso's), and Olga Koklowa, each of whom seems deeply scarred by their life with Picasso. Gilot's response is to bring each into her relationship with Picasso. How does one survive Picasso? She keeps painting, and she keeps her good humor and her independence. When the time comes, she has the strength to leave.",Surviving Picasso,[],Surviving Picasso,http://www.imdb.com/title/tt0117791/?ref_=fn_tt_tt_1,   (1996) ,"['Arianna Huffington', 'Ruth Prawer Jhabvala']",1996
tt0118073,PG-13,"A man claiming to be Carol Brady's long-lost first husband, Roy Martin, shows up at the suburban Brady residence one evening. An impostor, the man is actually determined to steal the Bradys...
                    See full summary",Arlene Sanford,['Comedy'],90,['A Brady csal&#225;d 2.'],1.85 : 1,"$15,000,000              (estimated)",['USA'],"['The Garrish Swim Club Pasadena', 'California', 'USA']","$21,397,954              (USA)      (17 November 1996)",['English'],['Dolby'],,https://images-na.ssl-images-amazon.com/images/M/MV5BYWU3YzYxZTgtMmRmOC00ZDE2LWEyMjAtNTQ4NTExNzE0NDYyXkEyXkFqcGdeQXVyMTQxNzMzNDI@._V1_.jpg,"https://images-na.ssl-images-amazon.com/images/M/MV5BYWU3YzYxZTgtMmRmOC00ZDE2LWEyMjAtNTQ4NTExNzE0NDYyXkEyXkFqcGdeQXVyMTQxNzMzNDI@._V1_UX182_CR0,0,182,268_AL_.jpg",5.6,"8,777",1996-08-23,"['Shelley Long', 'Gary Cole', 'Tim Matheson']","A man claiming to be Carol Brady's long-lost first husband, Roy Martin, shows up at the suburban Brady residence one evening. An impostor, the man is actually determined to steal the Bradys' familiar horse statue, a $20-million ancient Asian artifact.",A Very Brady Sequel,[],A Very Brady Sequel,http://www.imdb.com/title/tt0118073/?ref_=fn_tt_tt_1,   (1996) ,"['Sherwood Schwartz', 'Harry Elfont']",1996
tt0117887,PG,"A local Pennsylvania band scores a one hit wonder in 1964 and rides the star-making machinery as long as they can, with lots of help from its manager.",Tom Hanks,"['Comedy', 'Drama', 'Music']",108,['&#161;Eso que t&#250; haces!'],1.37 : 1,"$26,000,000              (estimated)",['USA'],"['Orpheum Theater - 842 S. Broadway', 'Downtown', 'Los Angeles', 'California', 'USA']","$25,809,813              (USA)      (24 January 1997)",['English'],"['Dolby Digital', 'SDDS', 'DTS']",,https://images-na.ssl-images-amazon.com/images/M/MV5BOWVmN2ZhZjgtZGEzMy00NDkxLWI5YWQtYTE2ZTk0YzIyMzc0XkEyXkFqcGdeQXVyMTQxNzMzNDI@._V1_.jpg,"https://images-na.ssl-images-amazon.com/images/M/MV5BOWVmN2ZhZjgtZGEzMy00NDkxLWI5YWQtYTE2ZTk0YzIyMzc0XkEyXkFqcGdeQXVyMTQxNzMzNDI@._V1_UX182_CR0,0,182,268_AL_.jpg",6.9,"53,759",1996-10-04,"['Tom Hanks', 'Liv Tyler', 'Charlize Theron']","Recounts a fable of a pop rock band formed a year after the Beatles took America by storm in early 1964. Jazz aficionado Guy Patterson, unhappily toiling in the family appliance store, is recruited into the band the Oneders (later renamed the Wonders) after regular drummer Chad breaks his arm. After Guy injects a four/four rock beat into lead singer Jimmy's ballad, the song's undeniable pop power flings the Wonders into a brief whirlwind of success, telling the tale of many American bands who attempted to grab the brass ring of rock and roll in the wake of the British Invasion.",That Thing You Do!,[],That Thing You Do!,http://www.imdb.com/title/tt0117887/?ref_=fn_tt_tt_1,   (1996) ,['Tom Hanks'],1996
